{
  "schemaVersion": 2,
  "artifactType": "sop-candidate-verification-v2",
  "producer": {
    "name": "@xgh/engineering-governance",
    "version": "2.0.0",
    "policyDigest": "eba8165bd069c0e85e5b08217ea260e7b027e85158404a50644c03b57a909aca"
  },
  "taskId": "global-sop-hardening-2",
  "contract": {
    "path": "/Users/xgh/Documents/VibeCoding/EngineeringGovernance/.delivery/tasks/global-sop-hardening-2/contract.yaml",
    "sha256": "89f66712b6e6a460b1dbb4cf1ed779b08fb4c5eb1b92ce339ff3a50d53ebf0f5",
    "digest": "7bd8ccb39a3920964834343c726931deea63b0a43a2079e1b525e41f1d85191d"
  },
  "candidate": {
    "path": "/Users/xgh/Documents/VibeCoding/EngineeringGovernance/.delivery/tasks/global-sop-hardening-2/candidate.yaml",
    "sha256": "6b908128c59d5c50075aa0138d37921ad0c3b5525fcfcd48a370ec31669c98e0",
    "digest": "7345e32d15149c57857800b5f196a3c81265dad6ce0068609224f85c298d8055"
  },
  "evidence": {
    "path": "/Users/xgh/Documents/VibeCoding/EngineeringGovernance/.delivery/tasks/global-sop-hardening-2/evidence.json",
    "sha256": "777ebd14ecc8c80dad49d0551ac9acce3c49038ad1e494985800272a857ed09a"
  },
  "receipts": [
    {
      "acceptanceId": "SOP2-REPAIR-01",
      "path": "/Users/xgh/Documents/VibeCoding/EngineeringGovernance/.delivery/tasks/global-sop-hardening-2/receipts/run-1/SOP2-REPAIR-01.json",
      "sha256": "8f15dcbb3ec25f9c6f4bef0a5a6c52ba980d8c081680d8ae35ff671c18ea4b60"
    }
  ],
  "authorizationArtifacts": [],
  "extensionArtifacts": [],
  "implementationIdentities": [
    {
      "repositoryId": "root",
      "repository": "/Users/xgh/Documents/VibeCoding/EngineeringGovernance",
      "commit": "5e93ba45bdce60dbf173f7b1e63b72b69acb1ebf",
      "tree": "5cb39e04f7dca18ff0ddbe38e883df20c8fbd565",
      "checkoutDigest": "9a48fbedded2fdb307737404b54c034034f92adee3d62617d6ca6475e225d378"
    }
  ],
  "authorizationTrust": [],
  "extensionResults": [],
  "replay": {
    "path": "/Users/xgh/Documents/VibeCoding/EngineeringGovernance/.delivery/tasks/global-sop-hardening-2/replay-verification.json",
    "sha256": "b84e13a57f679d03b56cc7b988c4faee74e7594ca42ed6b9f4ce4ade4a57b72b",
    "planDigest": "93bcfd4a887f1ddf57d7a878846e15f2da8f0ba577775fe48be962cdee04e1e3"
  },
  "verifiedAt": "2026-08-14T15:26:23.821Z",
  "decision": "eligible"
}
